{
  "candidate_id": "CAND007",
  "designation": "Data Analyst Fresher",
  "professional_summary": "Data Analyst fresher with a B.Sc. in Statistics and practical experience in data cleaning, exploratory data analysis, SQL querying, and dashboard creation.",
  "skills": [
    {
      "name": "Python",
      "category": "Programming"
    },
    {
      "name": "Pandas",
      "category": "Data Analysis"
    },
    {
      "name": "NumPy",
      "category": "Data Analysis"
    },
    {
      "name": "Matplotlib",
      "category": "Data Visualization"
    },
    {
      "name": "Seaborn",
      "category": "Data Visualization"
    },
    {
      "name": "SQL",
      "category": "Database"
    },
    {
      "name": "Data Cleaning",
      "category": "Data Analysis"
    },
    {
      "name": "Exploratory Data Analysis",
      "category": "Data Analysis"
    },
    {
      "name": "Hypothesis Testing",
      "category": "Statistics"
    },
    {
      "name": "Power BI",
      "category": "Business Intelligence"
    },
    {
      "name": "Tableau",
      "category": "Business Intelligence"
    },
    {
      "name": "Microsoft Excel",
      "category": "Analytics Tools"
    },
    {
      "name": "MySQL",
      "category": "Database"
    },
    {
      "name": "PostgreSQL",
      "category": "Database"
    },
    {
      "name": "Jupyter Notebook",
      "category": "Development Tools"
    }
  ],
  "experience": [
    {
      "designation": "Data Analyst Intern",
      "company": "InsightEdge Analytics",
      "start_date": "2026-01",
      "end_date": "2026-04"
    }
  ],
  "education": [
    {
      "degree": "Bachelor of Science",
      "field": "Statistics",
      "institution": "PSG College of Arts and Science",
      "graduation_year": 2026,
      "grade": "8.6/10 CGPA"
    }
  ],
  "certifications": [
    "Google Data Analytics Professional Certificate",
    "Microsoft Power BI Data Analyst - PL-300 Training",
    "SQL for Data Science - Coursera"
  ]
}